[
  {
    "agent_id": "claude-sonnet-5",
    "condition": "RAG",
    "case_id": "V7-HIST-01",
    "query_category": "historical_recall",
    "answer": "We tried approach A first. We abandoned it because latency was too high. We switched to approach B.",
    "factual_correct": true,
    "temporal_correct": true,
    "ambiguity_correct": null,
    "conflict_correct": null,
    "provenance_correct": null,
    "unsupported_claims": 0,
    "evidence_used": ["rag_chunk:c1(fallback)", "rag_chunk:c2(fallback)", "rag_chunk:c3(fallback)"],
    "input_tokens": null,
    "latency_ms": null
  },
  {
    "agent_id": "claude-sonnet-5",
    "condition": "RAG",
    "case_id": "V7-ACT-01",
    "query_category": "action_outcome",
    "answer": "Redis caching was attempted. It reduced repeated database reads but introduced stale-data issues, so the change was put on hold.",
    "factual_correct": true,
    "temporal_correct": null,
    "ambiguity_correct": null,
    "conflict_correct": null,
    "provenance_correct": null,
    "unsupported_claims": 0,
    "evidence_used": ["rag_chunk:c1(fallback)", "rag_chunk:c2(fallback)", "rag_chunk:c3(fallback)"],
    "input_tokens": null,
    "latency_ms": null
  },
  {
    "agent_id": "claude-sonnet-5",
    "condition": "RAG",
    "case_id": "V7-TIME-01",
    "query_category": "temporal_state",
    "answer": "Based on retrieved evidence only, the service used polling in January. The retrieval under this run's fixed keyword-overlap policy did not surface the March (webhooks) or May (webhooks disabled) chunks, so the latest state and its full evolution cannot be confirmed from the evidence actually retrieved for this condition.",
    "factual_correct": false,
    "temporal_correct": false,
    "ambiguity_correct": null,
    "conflict_correct": null,
    "provenance_correct": null,
    "unsupported_claims": 0,
    "evidence_used": ["rag_chunk:c1(score=1)"],
    "input_tokens": null,
    "latency_ms": null
  },
  {
    "agent_id": "claude-sonnet-5",
    "condition": "RAG",
    "case_id": "V7-AMB-01",
    "query_category": "ambiguity",
    "answer": "Per retrieved evidence: the conversation did not establish whether 'He' meant Rahul or Arjun. The reference remains ambiguous.",
    "factual_correct": null,
    "temporal_correct": null,
    "ambiguity_correct": true,
    "conflict_correct": null,
    "provenance_correct": null,
    "unsupported_claims": 0,
    "evidence_used": ["rag_chunk:c3(score=1)"],
    "input_tokens": null,
    "latency_ms": null
  },
  {
    "agent_id": "claude-sonnet-5",
    "condition": "RAG",
    "case_id": "V7-CONFLICT-01",
    "query_category": "contradiction",
    "answer": "Agent A recorded the deployment target as Jaipur; Agent B recorded it as Delhi, with overlapping validity and no temporal explanation. The observations conflict and are not resolved by retrieved evidence.",
    "factual_correct": null,
    "temporal_correct": null,
    "ambiguity_correct": null,
    "conflict_correct": true,
    "provenance_correct": true,
    "unsupported_claims": 0,
    "evidence_used": ["rag_chunk:c1(score=2)", "rag_chunk:c2(score=2)"],
    "input_tokens": null,
    "latency_ms": null
  },
  {
    "agent_id": "claude-sonnet-5",
    "condition": "RAG",
    "case_id": "V7-NEG-01",
    "query_category": "negative_knowledge",
    "answer": "No. Retrieved evidence explicitly states there is no discussion of MongoDB anywhere in this benchmark case; PostgreSQL, Redis, and S3 are the discussed topics.",
    "factual_correct": true,
    "temporal_correct": null,
    "ambiguity_correct": null,
    "conflict_correct": null,
    "provenance_correct": null,
    "unsupported_claims": 0,
    "evidence_used": ["rag_chunk:c2(score=2)", "rag_chunk:c1(score=1)"],
    "input_tokens": null,
    "latency_ms": null
  },
  {
    "agent_id": "claude-sonnet-5",
    "condition": "RAG",
    "case_id": "V7-PROV-01",
    "query_category": "provenance",
    "answer": "Codex originally observed that the migration failed. Claude later confirmed the failure after reviewing the test output.",
    "factual_correct": true,
    "temporal_correct": null,
    "ambiguity_correct": null,
    "conflict_correct": null,
    "provenance_correct": true,
    "unsupported_claims": 0,
    "evidence_used": ["rag_chunk:c2(score=3)", "rag_chunk:c1(score=1)"],
    "input_tokens": null,
    "latency_ms": null
  }
]
