[
  {"agent_id":"copilot","condition":"V6","case_id":"V7-HIST-01","query_category":"historical_recall","answer":"Approach A was tried first; excessive latency caused failure, and the next approach was B.","factual_correct":true,"temporal_correct":true,"ambiguity_correct":null,"conflict_correct":null,"provenance_correct":true,"unsupported_claims":0,"evidence_used":["obs-hist-1","obs-hist-2","obs-hist-3"],"input_tokens":null,"latency_ms":null},
  {"agent_id":"copilot","condition":"V6","case_id":"V7-ACT-01","query_category":"action_outcome","answer":"Redis caching was attempted; it reduced repeated database reads, introduced stale-data issues, and was put on hold.","factual_correct":true,"temporal_correct":true,"ambiguity_correct":null,"conflict_correct":null,"provenance_correct":true,"unsupported_claims":0,"evidence_used":["obs-act-1","obs-act-2","obs-act-3","obs-act-4"],"input_tokens":null,"latency_ms":null},
  {"agent_id":"copilot","condition":"V6","case_id":"V7-TIME-01","query_category":"temporal_state","answer":"Polling was used in January, changed to webhooks in March, and webhooks were temporarily disabled during migration in May. The latest known state is temporarily disabled webhooks.","factual_correct":true,"temporal_correct":true,"ambiguity_correct":null,"conflict_correct":null,"provenance_correct":true,"unsupported_claims":0,"evidence_used":["obs-time-1","obs-time-2","obs-time-3"],"input_tokens":null,"latency_ms":null},
  {"agent_id":"copilot","condition":"V6","case_id":"V7-AMB-01","query_category":"ambiguity","answer":"The reference remains unresolved; the supplied memory does not establish whether 'He' meant Rahul or Arjun.","factual_correct":true,"temporal_correct":null,"ambiguity_correct":true,"conflict_correct":null,"provenance_correct":true,"unsupported_claims":0,"evidence_used":["obs-amb-1","obs-amb-2"],"input_tokens":null,"latency_ms":null},
  {"agent_id":"copilot","condition":"V6","case_id":"V7-CONFLICT-01","query_category":"contradiction","answer":"Agent A recorded Jaipur and Agent B recorded Delhi. The overlapping observations conflict without a temporal explanation, so the target is disputed and both sources are retained.","factual_correct":true,"temporal_correct":true,"ambiguity_correct":null,"conflict_correct":true,"provenance_correct":true,"unsupported_claims":0,"evidence_used":["obs-conflict-1","obs-conflict-2","obs-conflict-3"],"input_tokens":null,"latency_ms":null},
  {"agent_id":"copilot","condition":"V6","case_id":"V7-NEG-01","query_category":"negative_knowledge","answer":"No. The memory records that the complete conversation did not contain MongoDB.","factual_correct":true,"temporal_correct":null,"ambiguity_correct":null,"conflict_correct":null,"provenance_correct":true,"unsupported_claims":0,"evidence_used":["obs-neg-1","obs-neg-2"],"input_tokens":null,"latency_ms":null},
  {"agent_id":"copilot","condition":"V6","case_id":"V7-PROV-01","query_category":"provenance","answer":"Codex originally observed the migration failure, and Claude later confirmed it after reviewing test output.","factual_correct":true,"temporal_correct":true,"ambiguity_correct":null,"conflict_correct":null,"provenance_correct":true,"unsupported_claims":0,"evidence_used":["obs-prov-1","obs-prov-2"],"input_tokens":null,"latency_ms":null}
]
