[
  {
    "agent_id": "codex",
    "condition": "V6",
    "case_id": "V7-HIST-01",
    "query_category": "historical_recall",
    "answer": "Per V6 memory, approach A was the first attempted approach, it failed because latency was too high, and the state then changed to approach B.",
    "factual_correct": true,
    "temporal_correct": true,
    "ambiguity_correct": null,
    "conflict_correct": null,
    "provenance_correct": true,
    "unsupported_claims": 0,
    "evidence_used": ["v6:V7-HIST-01:obs-1", "v6:V7-HIST-01:obs-2", "v6:V7-HIST-01:obs-3"],
    "input_tokens": null,
    "latency_ms": null
  },
  {
    "agent_id": "codex",
    "condition": "V6",
    "case_id": "V7-ACT-01",
    "query_category": "action_outcome",
    "answer": "Per V6 memory, Redis caching was tested. The outcome was mixed: repeated database reads decreased, stale-data issues appeared, and the change was put on hold.",
    "factual_correct": true,
    "temporal_correct": true,
    "ambiguity_correct": null,
    "conflict_correct": null,
    "provenance_correct": true,
    "unsupported_claims": 0,
    "evidence_used": ["v6:V7-ACT-01:action-1", "v6:V7-ACT-01:outcome-1", "v6:V7-ACT-01:outcome-2", "v6:V7-ACT-01:state-1"],
    "input_tokens": null,
    "latency_ms": null
  },
  {
    "agent_id": "codex",
    "condition": "V6",
    "case_id": "V7-TIME-01",
    "query_category": "temporal_state",
    "answer": "Per V6 memory, the service state evolved from polling in January, to webhooks in March, to webhooks temporarily disabled during migration in May. The latest known state is temporary webhook disablement.",
    "factual_correct": true,
    "temporal_correct": true,
    "ambiguity_correct": null,
    "conflict_correct": null,
    "provenance_correct": true,
    "unsupported_claims": 0,
    "evidence_used": ["v6:V7-TIME-01:state-jan", "v6:V7-TIME-01:state-mar", "v6:V7-TIME-01:state-may"],
    "input_tokens": null,
    "latency_ms": null
  },
  {
    "agent_id": "codex",
    "condition": "V6",
    "case_id": "V7-AMB-01",
    "query_category": "ambiguity",
    "answer": "Per V6 memory, the 'He' reference remains unresolved. Candidate referents are Rahul and Arjun, and the memory does not establish one over the other.",
    "factual_correct": true,
    "temporal_correct": null,
    "ambiguity_correct": true,
    "conflict_correct": null,
    "provenance_correct": true,
    "unsupported_claims": 0,
    "evidence_used": ["v6:V7-AMB-01:amb-1", "v6:V7-AMB-01:candidate-rahul", "v6:V7-AMB-01:candidate-arjun"],
    "input_tokens": null,
    "latency_ms": null
  },
  {
    "agent_id": "codex",
    "condition": "V6",
    "case_id": "V7-CONFLICT-01",
    "query_category": "contradiction",
    "answer": "Per V6 memory, Agent A recorded Jaipur and Agent B recorded Delhi as the deployment target. The observations overlap without a temporal explanation, so the deployment target is disputed and both source observations must be preserved.",
    "factual_correct": true,
    "temporal_correct": true,
    "ambiguity_correct": null,
    "conflict_correct": true,
    "provenance_correct": true,
    "unsupported_claims": 0,
    "evidence_used": ["v6:V7-CONFLICT-01:agent-a-jaipur", "v6:V7-CONFLICT-01:agent-b-delhi", "v6:V7-CONFLICT-01:conflict-status"],
    "input_tokens": null,
    "latency_ms": null
  },
  {
    "agent_id": "codex",
    "condition": "V6",
    "case_id": "V7-NEG-01",
    "query_category": "negative_knowledge",
    "answer": "Per V6 memory, the complete benchmark conversation covers PostgreSQL, Redis, and S3, and MongoDB is marked not discussed. Because the memory marks the evidence set as complete for this case, the negative answer is supported.",
    "factual_correct": true,
    "temporal_correct": null,
    "ambiguity_correct": null,
    "conflict_correct": null,
    "provenance_correct": true,
    "unsupported_claims": 0,
    "evidence_used": ["v6:V7-NEG-01:complete-topic-set", "v6:V7-NEG-01:mongodb-not-discussed"],
    "input_tokens": null,
    "latency_ms": null
  },
  {
    "agent_id": "codex",
    "condition": "V6",
    "case_id": "V7-PROV-01",
    "query_category": "provenance",
    "answer": "Per V6 memory, Codex originally observed the migration failure, and Claude later confirmed that failure after reviewing the test output.",
    "factual_correct": true,
    "temporal_correct": true,
    "ambiguity_correct": null,
    "conflict_correct": null,
    "provenance_correct": true,
    "unsupported_claims": 0,
    "evidence_used": ["v6:V7-PROV-01:codex-observation", "v6:V7-PROV-01:claude-confirmation"],
    "input_tokens": null,
    "latency_ms": null
  }
]
