[
  {
    "agent_id": "claude-sonnet-5",
    "condition": "V6",
    "case_id": "V7-HIST-01",
    "query_category": "historical_recall",
    "answer": "Per memory (proposition HIST-01-P1): approach A was tried first, abandoned due to high latency, then approach B was adopted. Current state: approach B.",
    "factual_correct": true,
    "temporal_correct": true,
    "ambiguity_correct": null,
    "conflict_correct": null,
    "provenance_correct": null,
    "unsupported_claims": 0,
    "evidence_used": ["v6:HIST-01-P1.o1", "v6:HIST-01-P1.o2", "v6:HIST-01-P1.o3"],
    "input_tokens": null,
    "latency_ms": null
  },
  {
    "agent_id": "claude-sonnet-5",
    "condition": "V6",
    "case_id": "V7-ACT-01",
    "query_category": "action_outcome",
    "answer": "Per memory (proposition ACT-01-P1): Redis caching was attempted, producing a mixed outcome (reduced database reads / stale-data issues introduced), and the change was put on hold.",
    "factual_correct": true,
    "temporal_correct": null,
    "ambiguity_correct": null,
    "conflict_correct": null,
    "provenance_correct": null,
    "unsupported_claims": 0,
    "evidence_used": ["v6:ACT-01-P1.o1", "v6:ACT-01-P1.o2", "v6:ACT-01-P1.o3", "v6:ACT-01-P1.o4"],
    "input_tokens": null,
    "latency_ms": null
  },
  {
    "agent_id": "claude-sonnet-5",
    "condition": "V6",
    "case_id": "V7-TIME-01",
    "query_category": "temporal_state",
    "answer": "Per memory (proposition TIME-01-P1): polling (January) was superseded by webhooks (March), which was superseded by webhooks disabled temporarily during migration (May). Current state: webhooks disabled temporarily as of May.",
    "factual_correct": true,
    "temporal_correct": true,
    "ambiguity_correct": null,
    "conflict_correct": null,
    "provenance_correct": null,
    "unsupported_claims": 0,
    "evidence_used": ["v6:TIME-01-P1.o1", "v6:TIME-01-P1.o2", "v6:TIME-01-P1.o3"],
    "input_tokens": null,
    "latency_ms": null
  },
  {
    "agent_id": "claude-sonnet-5",
    "condition": "V6",
    "case_id": "V7-AMB-01",
    "query_category": "ambiguity",
    "answer": "Per memory (ambiguity record amb1, proposition AMB-01-P1): the reference is unresolved between Rahul and Arjun as candidate referents.",
    "factual_correct": null,
    "temporal_correct": null,
    "ambiguity_correct": true,
    "conflict_correct": null,
    "provenance_correct": null,
    "unsupported_claims": 0,
    "evidence_used": ["v6:AMB-01-P1.amb1"],
    "input_tokens": null,
    "latency_ms": null
  },
  {
    "agent_id": "claude-sonnet-5",
    "condition": "V6",
    "case_id": "V7-CONFLICT-01",
    "query_category": "contradiction",
    "answer": "Per memory (proposition CONFLICT-01-P1, conflict record c1): the deployment target is disputed — Jaipur recorded by Agent A, Delhi recorded by Agent B, resolution_status disputed. Both observations are preserved with provenance.",
    "factual_correct": null,
    "temporal_correct": null,
    "ambiguity_correct": null,
    "conflict_correct": true,
    "provenance_correct": true,
    "unsupported_claims": 0,
    "evidence_used": ["v6:CONFLICT-01-P1.o1", "v6:CONFLICT-01-P1.o2", "v6:CONFLICT-01-P1.c1"],
    "input_tokens": null,
    "latency_ms": null
  },
  {
    "agent_id": "claude-sonnet-5",
    "condition": "V6",
    "case_id": "V7-NEG-01",
    "query_category": "negative_knowledge",
    "answer": "Per memory (negative_knowledge record on proposition NEG-01-P1): MongoDB status is not_discussed, with completeness_of_evidence marked complete for this benchmark case. Discussed topics on record: PostgreSQL, Redis, S3.",
    "factual_correct": true,
    "temporal_correct": null,
    "ambiguity_correct": null,
    "conflict_correct": null,
    "provenance_correct": null,
    "unsupported_claims": 0,
    "evidence_used": ["v6:NEG-01-P1.negative_knowledge", "v6:NEG-01-P1.o1", "v6:NEG-01-P1.o2", "v6:NEG-01-P1.o3"],
    "input_tokens": null,
    "latency_ms": null
  },
  {
    "agent_id": "claude-sonnet-5",
    "condition": "V6",
    "case_id": "V7-PROV-01",
    "query_category": "provenance",
    "answer": "Per memory (proposition PROV-01-P1): Codex originally observed the migration failure (o1); Claude later confirmed it after reviewing test output (o2, linked to o1).",
    "factual_correct": true,
    "temporal_correct": null,
    "ambiguity_correct": null,
    "conflict_correct": null,
    "provenance_correct": true,
    "unsupported_claims": 0,
    "evidence_used": ["v6:PROV-01-P1.o1", "v6:PROV-01-P1.o2"],
    "input_tokens": null,
    "latency_ms": null
  }
]
