[
  {
    "agent_id": "claude-sonnet-5",
    "condition": "V6+RAW",
    "case_id": "V7-HIST-01",
    "query_category": "historical_recall",
    "answer": "Per memory (HIST-01-P1), cross-checked against linked raw evidence: approach A was tried first, abandoned due to high latency, then approach B was adopted. Raw evidence confirms all three observations exactly.",
    "factual_correct": true,
    "temporal_correct": true,
    "ambiguity_correct": null,
    "conflict_correct": null,
    "provenance_correct": null,
    "unsupported_claims": 0,
    "evidence_used": ["v6:HIST-01-P1.o1", "v6:HIST-01-P1.o2", "v6:HIST-01-P1.o3", "raw_conversation"],
    "input_tokens": null,
    "latency_ms": null
  },
  {
    "agent_id": "claude-sonnet-5",
    "condition": "V6+RAW",
    "case_id": "V7-ACT-01",
    "query_category": "action_outcome",
    "answer": "Per memory (ACT-01-P1), verified against raw evidence: Redis caching was attempted, produced a mixed outcome (reduced reads / stale-data issues), and was put on hold. No discrepancy between memory and raw text.",
    "factual_correct": true,
    "temporal_correct": null,
    "ambiguity_correct": null,
    "conflict_correct": null,
    "provenance_correct": null,
    "unsupported_claims": 0,
    "evidence_used": ["v6:ACT-01-P1.o1", "v6:ACT-01-P1.o2", "v6:ACT-01-P1.o3", "v6:ACT-01-P1.o4", "raw_conversation"],
    "input_tokens": null,
    "latency_ms": null
  },
  {
    "agent_id": "claude-sonnet-5",
    "condition": "V6+RAW",
    "case_id": "V7-TIME-01",
    "query_category": "temporal_state",
    "answer": "Per memory (TIME-01-P1), confirmed against full raw conversation: polling (January) -> webhooks (March) -> webhooks disabled temporarily during migration (May). Current state: webhooks disabled temporarily as of May. Raw evidence confirms the RAG condition's gap (missing March/May) was a retrieval-policy artifact, not missing information.",
    "factual_correct": true,
    "temporal_correct": true,
    "ambiguity_correct": null,
    "conflict_correct": null,
    "provenance_correct": null,
    "unsupported_claims": 0,
    "evidence_used": ["v6:TIME-01-P1.o1", "v6:TIME-01-P1.o2", "v6:TIME-01-P1.o3", "raw_conversation"],
    "input_tokens": null,
    "latency_ms": null
  },
  {
    "agent_id": "claude-sonnet-5",
    "condition": "V6+RAW",
    "case_id": "V7-AMB-01",
    "query_category": "ambiguity",
    "answer": "Per memory (amb1) and confirmed against raw conversation: the reference 'He' remains unresolved between Rahul and Arjun; no additional disambiguating text exists in the full conversation.",
    "factual_correct": null,
    "temporal_correct": null,
    "ambiguity_correct": true,
    "conflict_correct": null,
    "provenance_correct": null,
    "unsupported_claims": 0,
    "evidence_used": ["v6:AMB-01-P1.amb1", "raw_conversation"],
    "input_tokens": null,
    "latency_ms": null
  },
  {
    "agent_id": "claude-sonnet-5",
    "condition": "V6+RAW",
    "case_id": "V7-CONFLICT-01",
    "query_category": "contradiction",
    "answer": "Per memory (CONFLICT-01-P1/c1), confirmed against raw text: deployment target is disputed between Jaipur (Agent A) and Delhi (Agent B); raw evidence confirms no temporal explanation exists that would justify resolving the conflict.",
    "factual_correct": null,
    "temporal_correct": null,
    "ambiguity_correct": null,
    "conflict_correct": true,
    "provenance_correct": true,
    "unsupported_claims": 0,
    "evidence_used": ["v6:CONFLICT-01-P1.o1", "v6:CONFLICT-01-P1.o2", "v6:CONFLICT-01-P1.c1", "raw_conversation"],
    "input_tokens": null,
    "latency_ms": null
  },
  {
    "agent_id": "claude-sonnet-5",
    "condition": "V6+RAW",
    "case_id": "V7-NEG-01",
    "query_category": "negative_knowledge",
    "answer": "Per memory and confirmed against raw text: MongoDB was not discussed; PostgreSQL, Redis, and S3 were. Raw text explicitly states completeness for this case, supporting the negative claim.",
    "factual_correct": true,
    "temporal_correct": null,
    "ambiguity_correct": null,
    "conflict_correct": null,
    "provenance_correct": null,
    "unsupported_claims": 0,
    "evidence_used": ["v6:NEG-01-P1.negative_knowledge", "raw_conversation"],
    "input_tokens": null,
    "latency_ms": null
  },
  {
    "agent_id": "claude-sonnet-5",
    "condition": "V6+RAW",
    "case_id": "V7-PROV-01",
    "query_category": "provenance",
    "answer": "Per memory (PROV-01-P1), confirmed against raw text: Codex originally observed the migration failure; Claude later confirmed it after reviewing test output. Raw evidence matches memory exactly.",
    "factual_correct": true,
    "temporal_correct": null,
    "ambiguity_correct": null,
    "conflict_correct": null,
    "provenance_correct": true,
    "unsupported_claims": 0,
    "evidence_used": ["v6:PROV-01-P1.o1", "v6:PROV-01-P1.o2", "raw_conversation"],
    "input_tokens": null,
    "latency_ms": null
  }
]
