[
  {"agent_id":"copilot","condition":"RAG","case_id":"V7-HIST-01","query_category":"historical_recall","answer":"Approach A was tried first; it was abandoned because latency was too high, and the team switched to approach B.","factual_correct":true,"temporal_correct":true,"ambiguity_correct":null,"conflict_correct":null,"provenance_correct":null,"unsupported_claims":0,"evidence_used":["rag:V7-HIST-01:chunk-1"],"input_tokens":null,"latency_ms":null},
  {"agent_id":"copilot","condition":"RAG","case_id":"V7-ACT-01","query_category":"action_outcome","answer":"We attempted Redis caching. It reduced repeated database reads but introduced stale-data issues, so the change was put on hold.","factual_correct":true,"temporal_correct":true,"ambiguity_correct":null,"conflict_correct":null,"provenance_correct":null,"unsupported_claims":0,"evidence_used":["rag:V7-ACT-01:chunk-1"],"input_tokens":null,"latency_ms":null},
  {"agent_id":"copilot","condition":"RAG","case_id":"V7-TIME-01","query_category":"temporal_state","answer":"Polling was used in January, changed to webhooks in March, and webhooks were temporarily disabled during migration in May. The latest known state is temporarily disabled webhooks.","factual_correct":true,"temporal_correct":true,"ambiguity_correct":null,"conflict_correct":null,"provenance_correct":null,"unsupported_claims":0,"evidence_used":["rag:V7-TIME-01:chunk-1"],"input_tokens":null,"latency_ms":null},
  {"agent_id":"copilot","condition":"RAG","case_id":"V7-AMB-01","query_category":"ambiguity","answer":"The reference remains ambiguous; the conversation does not establish whether 'He' meant Rahul or Arjun.","factual_correct":true,"temporal_correct":null,"ambiguity_correct":true,"conflict_correct":null,"provenance_correct":null,"unsupported_claims":0,"evidence_used":["rag:V7-AMB-01:chunk-1"],"input_tokens":null,"latency_ms":null},
  {"agent_id":"copilot","condition":"RAG","case_id":"V7-CONFLICT-01","query_category":"contradiction","answer":"Agent A recorded Jaipur and Agent B recorded Delhi as the deployment target. They conflict with overlapping validity and no temporal explanation, so the target is disputed and both provenances are preserved.","factual_correct":true,"temporal_correct":true,"ambiguity_correct":null,"conflict_correct":true,"provenance_correct":true,"unsupported_claims":0,"evidence_used":["rag:V7-CONFLICT-01:chunk-1"],"input_tokens":null,"latency_ms":null},
  {"agent_id":"copilot","condition":"RAG","case_id":"V7-NEG-01","query_category":"negative_knowledge","answer":"No. The complete conversation establishes that MongoDB was not discussed.","factual_correct":true,"temporal_correct":null,"ambiguity_correct":null,"conflict_correct":null,"provenance_correct":null,"unsupported_claims":0,"evidence_used":["rag:V7-NEG-01:complete-chunk"],"input_tokens":null,"latency_ms":null},
  {"agent_id":"copilot","condition":"RAG","case_id":"V7-PROV-01","query_category":"provenance","answer":"Codex originally observed the migration failure, and Claude later confirmed it after reviewing the test output.","factual_correct":true,"temporal_correct":true,"ambiguity_correct":null,"conflict_correct":null,"provenance_correct":true,"unsupported_claims":0,"evidence_used":["rag:V7-PROV-01:chunk-1"],"input_tokens":null,"latency_ms":null}
]
