[
  {
    "agent_id": "codex",
    "condition": "RAW",
    "case_id": "V7-HIST-01",
    "query_category": "historical_recall",
    "answer": "Approach A was tried first. It was abandoned because latency was too high, and the next approach was approach B.",
    "factual_correct": true,
    "temporal_correct": true,
    "ambiguity_correct": null,
    "conflict_correct": null,
    "provenance_correct": null,
    "unsupported_claims": 0,
    "evidence_used": ["raw:V7-HIST-01:conversation"],
    "input_tokens": null,
    "latency_ms": null
  },
  {
    "agent_id": "codex",
    "condition": "RAW",
    "case_id": "V7-ACT-01",
    "query_category": "action_outcome",
    "answer": "Redis caching was attempted. It reduced repeated database reads, introduced stale-data issues, and the change was put on hold.",
    "factual_correct": true,
    "temporal_correct": true,
    "ambiguity_correct": null,
    "conflict_correct": null,
    "provenance_correct": null,
    "unsupported_claims": 0,
    "evidence_used": ["raw:V7-ACT-01:conversation"],
    "input_tokens": null,
    "latency_ms": null
  },
  {
    "agent_id": "codex",
    "condition": "RAW",
    "case_id": "V7-TIME-01",
    "query_category": "temporal_state",
    "answer": "The service used polling in January, changed to webhooks in March, and then had webhooks temporarily disabled during migration in May. The latest known state is that webhooks are temporarily disabled.",
    "factual_correct": true,
    "temporal_correct": true,
    "ambiguity_correct": null,
    "conflict_correct": null,
    "provenance_correct": null,
    "unsupported_claims": 0,
    "evidence_used": ["raw:V7-TIME-01:conversation"],
    "input_tokens": null,
    "latency_ms": null
  },
  {
    "agent_id": "codex",
    "condition": "RAW",
    "case_id": "V7-AMB-01",
    "query_category": "ambiguity",
    "answer": "The reference remains ambiguous. The conversation explicitly says it did not establish whether 'He' meant Rahul or Arjun.",
    "factual_correct": true,
    "temporal_correct": null,
    "ambiguity_correct": true,
    "conflict_correct": null,
    "provenance_correct": null,
    "unsupported_claims": 0,
    "evidence_used": ["raw:V7-AMB-01:conversation"],
    "input_tokens": null,
    "latency_ms": null
  },
  {
    "agent_id": "codex",
    "condition": "RAW",
    "case_id": "V7-CONFLICT-01",
    "query_category": "contradiction",
    "answer": "Memory says Agent A recorded Jaipur as the deployment target and Agent B later recorded Delhi. Because the observations have overlapping validity and no temporal explanation, the target is disputed rather than resolved.",
    "factual_correct": true,
    "temporal_correct": true,
    "ambiguity_correct": null,
    "conflict_correct": true,
    "provenance_correct": true,
    "unsupported_claims": 0,
    "evidence_used": ["raw:V7-CONFLICT-01:conversation"],
    "input_tokens": null,
    "latency_ms": null
  },
  {
    "agent_id": "codex",
    "condition": "RAW",
    "case_id": "V7-NEG-01",
    "query_category": "negative_knowledge",
    "answer": "No. The complete conversation discusses PostgreSQL, Redis, and S3, and it explicitly states that MongoDB was not discussed anywhere in the benchmark case.",
    "factual_correct": true,
    "temporal_correct": null,
    "ambiguity_correct": null,
    "conflict_correct": null,
    "provenance_correct": null,
    "unsupported_claims": 0,
    "evidence_used": ["raw:V7-NEG-01:complete-conversation"],
    "input_tokens": null,
    "latency_ms": null
  },
  {
    "agent_id": "codex",
    "condition": "RAW",
    "case_id": "V7-PROV-01",
    "query_category": "provenance",
    "answer": "Codex originally observed that the migration failed. Claude later confirmed the failure after reviewing the test output.",
    "factual_correct": true,
    "temporal_correct": true,
    "ambiguity_correct": null,
    "conflict_correct": null,
    "provenance_correct": true,
    "unsupported_claims": 0,
    "evidence_used": ["raw:V7-PROV-01:conversation"],
    "input_tokens": null,
    "latency_ms": null
  }
]
