[
  {
    "agent_id": "codex",
    "condition": "V6+RAW",
    "case_id": "V7-HIST-01",
    "query_category": "historical_recall",
    "answer": "V6 memory says approach A came first, failed because latency was too high, and was replaced by approach B; the linked raw evidence confirms the same sequence.",
    "factual_correct": true,
    "temporal_correct": true,
    "ambiguity_correct": null,
    "conflict_correct": null,
    "provenance_correct": true,
    "unsupported_claims": 0,
    "evidence_used": ["v6:V7-HIST-01:obs-1", "v6:V7-HIST-01:obs-2", "v6:V7-HIST-01:obs-3", "raw:V7-HIST-01:linked-conversation"],
    "input_tokens": null,
    "latency_ms": null
  },
  {
    "agent_id": "codex",
    "condition": "V6+RAW",
    "case_id": "V7-ACT-01",
    "query_category": "action_outcome",
    "answer": "V6 memory and linked raw evidence agree: Redis caching was tested; it reduced repeated database reads, introduced stale-data issues, and was put on hold.",
    "factual_correct": true,
    "temporal_correct": true,
    "ambiguity_correct": null,
    "conflict_correct": null,
    "provenance_correct": true,
    "unsupported_claims": 0,
    "evidence_used": ["v6:V7-ACT-01:action-1", "v6:V7-ACT-01:outcome-1", "v6:V7-ACT-01:outcome-2", "v6:V7-ACT-01:state-1", "raw:V7-ACT-01:linked-conversation"],
    "input_tokens": null,
    "latency_ms": null
  },
  {
    "agent_id": "codex",
    "condition": "V6+RAW",
    "case_id": "V7-TIME-01",
    "query_category": "temporal_state",
    "answer": "V6 memory and linked raw evidence agree on the temporal sequence: polling in January, webhooks in March, then webhooks temporarily disabled during migration in May. The latest known state is temporary webhook disablement.",
    "factual_correct": true,
    "temporal_correct": true,
    "ambiguity_correct": null,
    "conflict_correct": null,
    "provenance_correct": true,
    "unsupported_claims": 0,
    "evidence_used": ["v6:V7-TIME-01:state-jan", "v6:V7-TIME-01:state-mar", "v6:V7-TIME-01:state-may", "raw:V7-TIME-01:linked-conversation"],
    "input_tokens": null,
    "latency_ms": null
  },
  {
    "agent_id": "codex",
    "condition": "V6+RAW",
    "case_id": "V7-AMB-01",
    "query_category": "ambiguity",
    "answer": "V6 memory marks the 'He' reference as unresolved between Rahul and Arjun, and the linked raw evidence explicitly says the conversation did not establish which person was meant.",
    "factual_correct": true,
    "temporal_correct": null,
    "ambiguity_correct": true,
    "conflict_correct": null,
    "provenance_correct": true,
    "unsupported_claims": 0,
    "evidence_used": ["v6:V7-AMB-01:amb-1", "v6:V7-AMB-01:candidate-rahul", "v6:V7-AMB-01:candidate-arjun", "raw:V7-AMB-01:linked-conversation"],
    "input_tokens": null,
    "latency_ms": null
  },
  {
    "agent_id": "codex",
    "condition": "V6+RAW",
    "case_id": "V7-CONFLICT-01",
    "query_category": "contradiction",
    "answer": "V6 memory and linked raw evidence preserve the conflict: Agent A recorded Jaipur and Agent B recorded Delhi, with overlapping validity and no temporal explanation. The deployment target remains disputed.",
    "factual_correct": true,
    "temporal_correct": true,
    "ambiguity_correct": null,
    "conflict_correct": true,
    "provenance_correct": true,
    "unsupported_claims": 0,
    "evidence_used": ["v6:V7-CONFLICT-01:agent-a-jaipur", "v6:V7-CONFLICT-01:agent-b-delhi", "v6:V7-CONFLICT-01:conflict-status", "raw:V7-CONFLICT-01:linked-conversation"],
    "input_tokens": null,
    "latency_ms": null
  },
  {
    "agent_id": "codex",
    "condition": "V6+RAW",
    "case_id": "V7-NEG-01",
    "query_category": "negative_knowledge",
    "answer": "V6 memory marks the case evidence as complete and MongoDB as not discussed; the linked raw evidence confirms that only PostgreSQL, Redis, and S3 were discussed and that MongoDB appears nowhere in the case.",
    "factual_correct": true,
    "temporal_correct": null,
    "ambiguity_correct": null,
    "conflict_correct": null,
    "provenance_correct": true,
    "unsupported_claims": 0,
    "evidence_used": ["v6:V7-NEG-01:complete-topic-set", "v6:V7-NEG-01:mongodb-not-discussed", "raw:V7-NEG-01:linked-complete-conversation"],
    "input_tokens": null,
    "latency_ms": null
  },
  {
    "agent_id": "codex",
    "condition": "V6+RAW",
    "case_id": "V7-PROV-01",
    "query_category": "provenance",
    "answer": "V6 memory and linked raw evidence agree: Codex originally observed the migration failure, and Claude later confirmed it after reviewing the test output.",
    "factual_correct": true,
    "temporal_correct": true,
    "ambiguity_correct": null,
    "conflict_correct": null,
    "provenance_correct": true,
    "unsupported_claims": 0,
    "evidence_used": ["v6:V7-PROV-01:codex-observation", "v6:V7-PROV-01:claude-confirmation", "raw:V7-PROV-01:linked-conversation"],
    "input_tokens": null,
    "latency_ms": null
  }
]
