[
  {
    "agent_id": "claude-sonnet-5",
    "condition": "RAW",
    "case_id": "V7-HIST-01",
    "query_category": "historical_recall",
    "answer": "We tried approach A first. We abandoned it because latency was too high. We switched to approach B.",
    "factual_correct": true,
    "temporal_correct": true,
    "ambiguity_correct": null,
    "conflict_correct": null,
    "provenance_correct": null,
    "unsupported_claims": 0,
    "evidence_used": ["raw_conversation"],
    "input_tokens": null,
    "latency_ms": null
  },
  {
    "agent_id": "claude-sonnet-5",
    "condition": "RAW",
    "case_id": "V7-ACT-01",
    "query_category": "action_outcome",
    "answer": "Redis caching was attempted. It reduced repeated database reads but introduced stale-data issues, so the change was put on hold.",
    "factual_correct": true,
    "temporal_correct": null,
    "ambiguity_correct": null,
    "conflict_correct": null,
    "provenance_correct": null,
    "unsupported_claims": 0,
    "evidence_used": ["raw_conversation"],
    "input_tokens": null,
    "latency_ms": null
  },
  {
    "agent_id": "claude-sonnet-5",
    "condition": "RAW",
    "case_id": "V7-TIME-01",
    "query_category": "temporal_state",
    "answer": "Latest state: webhooks temporarily disabled (May) during migration. Evolution: polling (January) -> webhooks (March) -> webhooks temporarily disabled (May).",
    "factual_correct": true,
    "temporal_correct": true,
    "ambiguity_correct": null,
    "conflict_correct": null,
    "provenance_correct": null,
    "unsupported_claims": 0,
    "evidence_used": ["raw_conversation"],
    "input_tokens": null,
    "latency_ms": null
  },
  {
    "agent_id": "claude-sonnet-5",
    "condition": "RAW",
    "case_id": "V7-AMB-01",
    "query_category": "ambiguity",
    "answer": "The conversation does not establish whether 'He' refers to Rahul or Arjun; the reference is ambiguous and unresolved.",
    "factual_correct": null,
    "temporal_correct": null,
    "ambiguity_correct": true,
    "conflict_correct": null,
    "provenance_correct": null,
    "unsupported_claims": 0,
    "evidence_used": ["raw_conversation"],
    "input_tokens": null,
    "latency_ms": null
  },
  {
    "agent_id": "claude-sonnet-5",
    "condition": "RAW",
    "case_id": "V7-CONFLICT-01",
    "query_category": "contradiction",
    "answer": "Two conflicting observations exist: Agent A recorded Jaipur, Agent B recorded Delhi, with overlapping validity and no temporal explanation. The disagreement is preserved rather than resolved.",
    "factual_correct": null,
    "temporal_correct": null,
    "ambiguity_correct": null,
    "conflict_correct": true,
    "provenance_correct": true,
    "unsupported_claims": 0,
    "evidence_used": ["raw_conversation"],
    "input_tokens": null,
    "latency_ms": null
  },
  {
    "agent_id": "claude-sonnet-5",
    "condition": "RAW",
    "case_id": "V7-NEG-01",
    "query_category": "negative_knowledge",
    "answer": "No. The complete conversation discusses PostgreSQL, Redis, and S3, and explicitly states MongoDB was not discussed.",
    "factual_correct": true,
    "temporal_correct": null,
    "ambiguity_correct": null,
    "conflict_correct": null,
    "provenance_correct": null,
    "unsupported_claims": 0,
    "evidence_used": ["raw_conversation"],
    "input_tokens": null,
    "latency_ms": null
  },
  {
    "agent_id": "claude-sonnet-5",
    "condition": "RAW",
    "case_id": "V7-PROV-01",
    "query_category": "provenance",
    "answer": "Codex originally observed that the migration failed. Claude later confirmed the failure after reviewing the test output.",
    "factual_correct": true,
    "temporal_correct": null,
    "ambiguity_correct": null,
    "conflict_correct": null,
    "provenance_correct": true,
    "unsupported_claims": 0,
    "evidence_used": ["raw_conversation"],
    "input_tokens": null,
    "latency_ms": null
  }
]
