[
  {
    "agent_id": "codex",
    "condition": "RAG",
    "case_id": "V7-HIST-01",
    "query_category": "historical_recall",
    "answer": "The retrieved chunk says approach A was tried first, failed because latency was too high, and was followed by approach B.",
    "factual_correct": true,
    "temporal_correct": true,
    "ambiguity_correct": null,
    "conflict_correct": null,
    "provenance_correct": null,
    "unsupported_claims": 0,
    "evidence_used": ["rag:V7-HIST-01:chunk-1"],
    "input_tokens": null,
    "latency_ms": null
  },
  {
    "agent_id": "codex",
    "condition": "RAG",
    "case_id": "V7-ACT-01",
    "query_category": "action_outcome",
    "answer": "The retrieved chunk says Redis caching was tested. It reduced repeated database reads, introduced stale-data issues, and was put on hold.",
    "factual_correct": true,
    "temporal_correct": true,
    "ambiguity_correct": null,
    "conflict_correct": null,
    "provenance_correct": null,
    "unsupported_claims": 0,
    "evidence_used": ["rag:V7-ACT-01:chunk-1"],
    "input_tokens": null,
    "latency_ms": null
  },
  {
    "agent_id": "codex",
    "condition": "RAG",
    "case_id": "V7-TIME-01",
    "query_category": "temporal_state",
    "answer": "The retrieved chunk gives the sequence: polling in January, webhooks in March, then webhooks temporarily disabled during migration in May. The latest known state is temporary webhook disablement.",
    "factual_correct": true,
    "temporal_correct": true,
    "ambiguity_correct": null,
    "conflict_correct": null,
    "provenance_correct": null,
    "unsupported_claims": 0,
    "evidence_used": ["rag:V7-TIME-01:chunk-1"],
    "input_tokens": null,
    "latency_ms": null
  },
  {
    "agent_id": "codex",
    "condition": "RAG",
    "case_id": "V7-AMB-01",
    "query_category": "ambiguity",
    "answer": "The retrieved chunk preserves the ambiguity: it does not establish whether 'He' referred to Rahul or Arjun.",
    "factual_correct": true,
    "temporal_correct": null,
    "ambiguity_correct": true,
    "conflict_correct": null,
    "provenance_correct": null,
    "unsupported_claims": 0,
    "evidence_used": ["rag:V7-AMB-01:chunk-1"],
    "input_tokens": null,
    "latency_ms": null
  },
  {
    "agent_id": "codex",
    "condition": "RAG",
    "case_id": "V7-CONFLICT-01",
    "query_category": "contradiction",
    "answer": "The retrieved chunk contains conflicting deployment-target observations: Agent A recorded Jaipur and Agent B recorded Delhi, with overlapping validity and no temporal explanation. The conflict should remain unresolved with both provenances retained.",
    "factual_correct": true,
    "temporal_correct": true,
    "ambiguity_correct": null,
    "conflict_correct": true,
    "provenance_correct": true,
    "unsupported_claims": 0,
    "evidence_used": ["rag:V7-CONFLICT-01:chunk-1"],
    "input_tokens": null,
    "latency_ms": null
  },
  {
    "agent_id": "codex",
    "condition": "RAG",
    "case_id": "V7-NEG-01",
    "query_category": "negative_knowledge",
    "answer": "No. The retrieved complete-case chunk says the conversation discusses PostgreSQL, Redis, and S3, and that MongoDB was not discussed anywhere in this benchmark case.",
    "factual_correct": true,
    "temporal_correct": null,
    "ambiguity_correct": null,
    "conflict_correct": null,
    "provenance_correct": null,
    "unsupported_claims": 0,
    "evidence_used": ["rag:V7-NEG-01:complete-case-chunk"],
    "input_tokens": null,
    "latency_ms": null
  },
  {
    "agent_id": "codex",
    "condition": "RAG",
    "case_id": "V7-PROV-01",
    "query_category": "provenance",
    "answer": "The retrieved chunk says Codex originally observed the migration failure, and Claude later confirmed it after reviewing the test output.",
    "factual_correct": true,
    "temporal_correct": true,
    "ambiguity_correct": null,
    "conflict_correct": null,
    "provenance_correct": true,
    "unsupported_claims": 0,
    "evidence_used": ["rag:V7-PROV-01:chunk-1"],
    "input_tokens": null,
    "latency_ms": null
  }
]
